{
  "schema_version": 1,
  "registry": {
    "name": "trusted-network-registry",
    "generated_at": "2026-05-17T00:00:00Z",
    "valid_until": "2026-05-17T01:00:00Z",
    "publisher_version": "0.1.0"
  },
  "entries": [
    {
      "id": "admin-static-example",
      "cidr": "198.51.100.0/24",
      "address_family": "ipv4",
      "kind": "static",
      "source_type": "config",
      "source_ref": "static-admin",
      "status": "active"
    },
    {
      "id": "admin-static-ipv6-example",
      "cidr": "2001:db8:100::/64",
      "address_family": "ipv6",
      "kind": "static",
      "source_type": "config",
      "source_ref": "static-admin-ipv6",
      "status": "active"
    },
    {
      "id": "meraki-wan1-ipv4",
      "cidr": "203.0.113.10/32",
      "address_family": "ipv4",
      "kind": "discovered",
      "source_type": "meraki_uplink_addresses",
      "source_ref": "wan1",
      "observed_at": "2026-05-17T00:00:00Z",
      "expires_at": "2026-05-17T01:00:00Z",
      "status": "active"
    },
    {
      "id": "meraki-wan2-ipv6",
      "cidr": "2001:db8::10/128",
      "address_family": "ipv6",
      "kind": "discovered",
      "source_type": "meraki_uplink_addresses",
      "source_ref": "wan2",
      "observed_at": "2026-05-17T00:00:00Z",
      "expires_at": "2026-05-17T01:00:00Z",
      "status": "active"
    }
  ],
  "summary": {
    "entry_count": 4,
    "static_count": 2,
    "discovered_count": 2
  }
}
